{
  "version": "1.0.0",
  "mode": "advanced",
  "generated_at": "2026-01-24T19:46:08.577728+00:00",
  "source": {
    "file": "docs/refs/hexmap.json",
    "exportDate": "2026-01-24T12:10:39.974Z"
  },
  "map": {
    "cols": 35,
    "rows": 31,
    "hexes": [
      {
        "id": "hex_0_0",
        "col": 0,
        "row": 0,
        "terrain": {
          "forest": true
        },
        "faction_id": "neuth"
      },
      {
        "id": "hex_0_1",
        "col": 0,
        "row": 1,
        "terrain": {
          "forest": true
        },
        "faction_id": "neuth"
      },
      {
        "id": "hex_0_2",
        "col": 0,
        "row": 2,
        "terrain": {
          "forest": true
        },
        "faction_id": "neuth"
      },
      {
        "id": "hex_0_3",
        "col": 0,
        "row": 3,
        "terrain": {
          "forest": true
        },
        "faction_id": "neuth"
      },
      {
        "id": "hex_0_4",
        "col": 0,
        "row": 4,
        "terrain": {
          "forest": true
        },
        "faction_id": "neuth"
      },
      {
        "id": "hex_0_5",
        "col": 0,
        "row": 5,
        "terrain": {
          "forest": true
        },
        "faction_id": "neuth"
      },
      {
        "id": "hex_0_6",
        "col": 0,
        "row": 6,
        "terrain": {
          "forest": true
        },
        "faction_id": "neuth"
      },
      {
        "id": "hex_0_7",
        "col": 0,
        "row": 7,
        "terrain": {
          "forest": true
        },
        "faction_id": "neuth"
      },
      {
        "id": "hex_0_8",
        "col": 0,
        "row": 8,
        "terrain": {
          "forest": true
        },
        "faction_id": "neuth"
      },
      {
        "id": "hex_0_9",
        "col": 0,
        "row": 9,
        "terrain": {
          "scenic": true
        },
        "name": "Stump Hole",
        "name_id": "stump_hole"
      },
      {
        "id": "hex_0_10",
        "col": 0,
        "row": 10,
        "terrain": {
          "hill": true
        }
      },
      {
        "id": "hex_0_11",
        "col": 0,
        "row": 11,
        "terrain": {
          "clear": true
        }
      },
      {
        "id": "hex_0_12",
        "col": 0,
        "row": 12,
        "terrain": {
          "seashore": true
        }
      },
      {
        "id": "hex_0_13",
        "col": 0,
        "row": 13,
        "terrain": {
          "sea": true
        }
      },
      {
        "id": "hex_0_14",
        "col": 0,
        "row": 14,
        "terrain": {
          "sea": true
        }
      },
      {
        "id": "hex_0_15",
        "col": 0,
        "row": 15,
        "terrain": {
          "sea": true
        }
      },
      {
        "id": "hex_0_16",
        "col": 0,
        "row": 16,
        "terrain": {
          "sea": true
        }
      },
      {
        "id": "hex_0_17",
        "col": 0,
        "row": 17,
        "terrain": {
          "sea": true
        }
      },
      {
        "id": "hex_0_18",
        "col": 0,
        "row": 18,
        "terrain": {
          "sea": true
        }
      },
      {
        "id": "hex_0_19",
        "col": 0,
        "row": 19,
        "terrain": {
          "sea": true
        }
      },
      {
        "id": "hex_0_20",
        "col": 0,
        "row": 20,
        "terrain": {
          "sea": true
        }
      },
      {
        "id": "hex_0_21",
        "col": 0,
        "row": 21,
        "terrain": {
          "sea": true
        }
      },
      {
        "id": "hex_0_22",
        "col": 0,
        "row": 22,
        "terrain": {
          "sea": true
        }
      },
      {
        "id": "hex_0_23",
        "col": 0,
        "row": 23,
        "terrain": {
          "sea": true
        }
      },
      {
        "id": "hex_0_24",
        "col": 0,
        "row": 24,
        "terrain": {
          "sea": true
        }
      },
      {
        "id": "hex_0_25",
        "col": 0,
        "row": 25,
        "terrain": {
          "sea": true
        }
      },
      {
        "id": "hex_0_26",
        "col": 0,
        "row": 26,
        "terrain": {
          "sea": true
        }
      },
      {
        "id": "hex_0_27",
        "col": 0,
        "row": 27,
        "terrain": {
          "sea": true
        }
      },
      {
        "id": "hex_0_28",
        "col": 0,
        "row": 28,
        "terrain": {
          "sea": true
        }
      },
      {
        "id": "hex_0_29",
        "col": 0,
        "row": 29,
        "terrain": {
          "sea": true
        }
      },
      {
        "id": "hex_0_30",
        "col": 0,
        "row": 30,
        "terrain": {
          "sea": true
        }
      },
      {
        "id": "hex_1_0",
        "col": 1,
        "row": 0,
        "terrain": {
          "forest": true,
          "scenic": true
        },
        "name": "The Haven",
        "name_id": "the_haven",
        "faction_id": "neuth"
      },
      {
        "id": "hex_1_1",
        "col": 1,
        "row": 1,
        "terrain": {
          "forest": true
        },
        "faction_id": "neuth"
      },
      {
        "id": "hex_1_2",
        "col": 1,
        "row": 2,
        "terrain": {
          "forest": true
        },
        "faction_id": "neuth"
      },
      {
        "id": "hex_1_3",
        "col": 1,
        "row": 3,
        "terrain": {
          "forest": true
        },
        "faction_id": "neuth"
      },
      {
        "id": "hex_1_4",
        "col": 1,
        "row": 4,
        "terrain": {
          "forest": true
        },
        "faction_id": "neuth"
      },
      {
        "id": "hex_1_5",
        "col": 1,
        "row": 5,
        "terrain": {
          "forest": true
        },
        "faction_id": "neuth"
      },
      {
        "id": "hex_1_6",
        "col": 1,
        "row": 6,
        "terrain": {
          "forest": true
        },
        "faction_id": "neuth"
      },
      {
        "id": "hex_1_7",
        "col": 1,
        "row": 7,
        "terrain": {
          "forest": true
        },
        "faction_id": "neuth"
      },
      {
        "id": "hex_1_8",
        "col": 1,
        "row": 8,
        "terrain": {
          "forest": true
        },
        "faction_id": "neuth"
      },
      {
        "id": "hex_1_9",
        "col": 1,
        "row": 9,
        "terrain": {
          "forest": true
        },
        "faction_id": "neuth"
      },
      {
        "id": "hex_1_10",
        "col": 1,
        "row": 10,
        "terrain": {
          "hill": true
        }
      },
      {
        "id": "hex_1_11",
        "col": 1,
        "row": 11,
        "terrain": {
          "hill": true
        }
      },
      {
        "id": "hex_1_12",
        "col": 1,
        "row": 12,
        "terrain": {
          "seashore": true
        }
      },
      {
        "id": "hex_1_13",
        "col": 1,
        "row": 13,
        "terrain": {
          "sea": true
        }
      },
      {
        "id": "hex_1_14",
        "col": 1,
        "row": 14,
        "terrain": {
          "sea": true
        }
      },
      {
        "id": "hex_1_15",
        "col": 1,
        "row": 15,
        "terrain": {
          "sea": true
        }
      },
      {
        "id": "hex_1_16",
        "col": 1,
        "row": 16,
        "terrain": {
          "sea": true
        }
      },
      {
        "id": "hex_1_17",
        "col": 1,
        "row": 17,
        "terrain": {
          "sea": true
        }
      },
      {
        "id": "hex_1_18",
        "col": 1,
        "row": 18,
        "terrain": {
          "sea": true
        }
      },
      {
        "id": "hex_1_19",
        "col": 1,
        "row": 19,
        "terrain": {
          "sea": true
        }
      },
      {
        "id": "hex_1_20",
        "col": 1,
        "row": 20,
        "terrain": {
          "sea": true
        }
      },
      {
        "id": "hex_1_21",
        "col": 1,
        "row": 21,
        "terrain": {
          "sea": true
        }
      },
      {
        "id": "hex_1_22",
        "col": 1,
        "row": 22,
        "terrain": {
          "sea": true
        }
      },
      {
        "id": "hex_1_23",
        "col": 1,
        "row": 23,
        "terrain": {
          "sea": true
        }
      },
      {
        "id": "hex_1_24",
        "col": 1,
        "row": 24,
        "terrain": {
          "sea": true
        }
      },
      {
        "id": "hex_1_25",
        "col": 1,
        "row": 25,
        "terrain": {
          "sea": true
        }
      },
      {
        "id": "hex_1_26",
        "col": 1,
        "row": 26,
        "terrain": {
          "sea": true
        }
      },
      {
        "id": "hex_1_27",
        "col": 1,
        "row": 27,
        "terrain": {
          "sea": true
        }
      },
      {
        "id": "hex_1_28",
        "col": 1,
        "row": 28,
        "terrain": {
          "sea": true
        }
      },
      {
        "id": "hex_1_29",
        "col": 1,
        "row": 29,
        "terrain": {
          "sea": true
        }
      },
      {
        "id": "hex_1_30",
        "col": 1,
        "row": 30,
        "terrain": {
          "sea": true
        }
      },
      {
        "id": "hex_2_0",
        "col": 2,
        "row": 0,
        "terrain": {
          "forest": true
        },
        "faction_id": "neuth"
      },
      {
        "id": "hex_2_1",
        "col": 2,
        "row": 1,
        "terrain": {
          "castle": true
        },
        "name": "Aws Noir",
        "name_id": "aws_noir",
        "city_id": "aws_noir",
        "faction_id": "ghem",
        "intrinsic_defense": 4
      },
      {
        "id": "hex_2_2",
        "col": 2,
        "row": 2,
        "terrain": {
          "mountain": true
        },
        "faction_id": "ghem"
      },
      {
        "id": "hex_2_3",
        "col": 2,
        "row": 3,
        "terrain": {